{"acceptance_gates": ["This artifact is a semantics design artifact, not a theorem-completion report.", "Every promoted Lean primitive must compile under local Lake and keep the no-sorry/no-admit/no-axiom/no-unsafe policy.", "Empirical sample semantics, outer convergence, bracketing numbers, and Donsker weak convergence must stay separate.", "Exact VdV&W theorem claims require source anchors, non-vacuity examples, and successful benchmark/theorem-hole promotion.", "AXLE may check or repair candidate code, but local Lake validation remains the public acceptance authority."], "blocked_primitives": ["outer-uniform-convergence", "primitive-l1-bracketing-number", "finite-bracketing-gc-assembly", "donsker-weak-convergence-target"], "depends_on_artifacts": ["artifacts/research/vdvw-theorem-inventory.json", "artifacts/research/vdvw-bracketing-gc-statement-candidates.json", "artifacts/research/vdvw-vc-donsker-proof-obligations.json"], "design_ready_primitives": ["empirical-sample-average", "measurable-function-class-l1"], "layer_counts": {"bracketing_number": 1, "donsker_semantics": 1, "empirical_sample": 1, "function_class_l1": 1, "gc_constructor": 1, "outer_convergence": 1}, "markdown_root": "Math Textbook Foundation/Vaart 1996 Weak Convergence and Emperical Process(1)/Markdown", "next_actions": ["Implement P12.M2 by adding Lean signature candidates for the L1 bracketing-number constructor.", "Materialize theorem-hole benchmark seeds listed in planned_theorem_hole_seed_ids after the signatures compile.", "Keep the exact outer-almost-sure Theorem 2.4.1 blocked until outer convergence primitives are promoted."], "notes": "P12.M1 maps the source-linked VdV&W theorem-card gaps into concrete Lean API signature targets and theorem-hole seed names. It deliberately separates current compiled handoffs from future primitive semantics so autoformalization cannot silently weaken outer convergence, bracketing-number, or Donsker assumptions.", "planned_theorem_hole_seed_count": 12, "planned_theorem_hole_seed_ids": ["empirical_sample_average_signature_seed", "empirical_process_at_endpoint_seed", "outer_supremum_deviation_signature_seed", "outer_gc_to_current_gc_bridge_seed", "l1_bracket_contains_function_seed", "l1_width_to_population_width_seed", "finite_l1_bracketing_number_constructor_seed", "finite_l1_bracketing_every_scale_to_sequence_route_seed", "vdvw_2_4_1_current_gc_bridge_seed", "vdvw_2_4_1_outer_almost_sure_statement_seed", "donsker_weak_convergence_signature_seed", "donsker_entropy_constructor_statement_seed"], "primitive_count": 6, "primitives": [{"current_lean_handoffs": ["StatInference.endpoint_strong_law_ae_real", "StatInference.finite_endpoint_strong_law_eventually_abs_le_real", "StatInference.EmpiricalDeviationSequenceOn"], "existing_benchmark_task_ids": ["finite_endpoint_strong_law_eventual_bound_seed", "bracketing_deterministic_bound_seed"], "human_review_required": true, "layer": "empirical_sample", "missing_existing_benchmark_task_ids": [], "planned_theorem_hole_seed_ids": ["empirical_sample_average_signature_seed", "empirical_process_at_endpoint_seed"], "primitive_id": "empirical-sample-average", "promotion_gate": "Promote only after the sample object and sample-average notation compile and preserve existing endpoint SLLN benchmarks.", "semantic_risks": ["Do not treat a sequence of arbitrary empirical risks as an iid empirical measure.", "Do not hide sample-size zero denominator behavior in empirical averages."], "source_anchor_ids": ["vdvw-gc-definition", "vdvw-2.4.1-finite-l1-bracketing-gc"], "status": "design_ready_for_lean_signature", "target_lean_module": "StatInference.EmpiricalProcess.Primitives", "target_lean_signatures": ["structure EmpiricalSample (\u03a9 : Type*) where sample : \u2115 -> \u03a9", "noncomputable def EmpiricalAverage (sample : EmpiricalSample \u03a9) (f : \u03a9 -> \u211d) (n : \u2115) : \u211d", "def EmpiricalProcessAt (sample : EmpiricalSample \u03a9) (PIntegral : (\u03a9 -> \u211d) -> \u211d) (f : \u03a9 -> \u211d) (n : \u2115) : \u211d"], "theorem_card_gaps": ["empirical measure P_n as sample averages of real-valued functions", "common sample object shared by all bracket endpoints", "population functional P f tied to the same function class"], "validation_hooks": ["add Lean signatures without proofs first", "render planned theorem-hole seeds before constructor proof work", "run lake build and no-sorry scan after promotion"]}, {"current_lean_handoffs": ["StatInference.GlivenkoCantelliClass", "StatInference.EmpiricalDeviationSequenceOn"], "existing_benchmark_task_ids": ["glivenko_cantelli_statement_seed", "l1_bracketing_sequence_gc_seed"], "human_review_required": true, "layer": "outer_convergence", "missing_existing_benchmark_task_ids": [], "planned_theorem_hole_seed_ids": ["outer_supremum_deviation_signature_seed", "outer_gc_to_current_gc_bridge_seed"], "primitive_id": "outer-uniform-convergence", "promotion_gate": "Promote only as semantics signatures until outer measurability and non-vacuity examples are available.", "semantic_risks": ["Replacing outer convergence by ordinary convergence changes the textbook theorem.", "A deterministic radius sequence is not itself an outer-probability statement."], "source_anchor_ids": ["vdvw-gc-definition", "vdvw-2.4.1-finite-l1-bracketing-gc"], "status": "blocked_pending_outer_probability_design", "target_lean_module": "StatInference.EmpiricalProcess.Outer", "target_lean_signatures": ["structure OuterProbabilitySpace (\u03a9 : Type*) [MeasurableSpace \u03a9] where outerProb : Set \u03a9 -> \u211d", "def OuterTendstoInProbability (outerProb : Set \u03a9 -> \u211d) (X : \u2115 -> \u03a9 -> \u211d) (limit : \u211d) : Prop", "def OuterAlmostSureTendsto (outerProb : Set \u03a9 -> \u211d) (X : \u2115 -> \u03a9 -> \u211d) (limit : \u211d) : Prop", "def OuterSupremumDeviation (F : Set (\u03a9 -> \u211d)) (empirical population : (\u03a9 -> \u211d) -> \u211d) : \u211d"], "theorem_card_gaps": ["outer probability P* and outer almost-sure convergence", "outer supremum norm ||P_n - P||*_F", "measurability policy for nonmeasurable suprema over function classes"], "validation_hooks": ["keep exact VdV&W Theorem 2.4.1 blocked until this module exists", "check that current deterministic GC interface is not labeled outer almost-sure", "use AXLE check only after local Lake accepts statement candidates"]}, {"current_lean_handoffs": ["StatInference.FiniteL1BracketingFamily", "StatInference.empiricalDeviationBoundOn_of_bracket_endpoint_bounds"], "existing_benchmark_task_ids": ["bracketing_deterministic_bound_seed", "trivial_bracketing_gc_non_vacuity_seed"], "human_review_required": true, "layer": "function_class_l1", "missing_existing_benchmark_task_ids": [], "planned_theorem_hole_seed_ids": ["l1_bracket_contains_function_seed", "l1_width_to_population_width_seed"], "primitive_id": "measurable-function-class-l1", "promotion_gate": "Promote only with explicit endpoint measurability and finite-norm fields or proof-carrying assumptions.", "semantic_risks": ["Endpoint finite-norm and measurability assumptions must remain explicit.", "The bracket endpoints need not belong to the function class."], "source_anchor_ids": ["vdvw-2.1.6-bracketing-number", "vdvw-2.4.1-finite-l1-bracketing-gc"], "status": "design_ready_for_lean_signature", "target_lean_module": "StatInference.EmpiricalProcess.L1Semantics", "target_lean_signatures": ["structure VdVWFunctionClass (\u03a9 : Type*) [MeasurableSpace \u03a9] where carrier : Set (\u03a9 -> \u211d)", "def L1Width (PIntegral : (\u03a9 -> \u211d) -> \u211d) (lower upper : \u03a9 -> \u211d) : \u211d", "structure L1Bracket (PIntegral : (\u03a9 -> \u211d) -> \u211d) (epsilon : \u211d) where lower upper : \u03a9 -> \u211d"], "theorem_card_gaps": ["measurable real-valued function class", "finite L1(P)-norm bracket endpoints", "pointwise lower <= f <= upper relation"], "validation_hooks": ["compile signatures before linking to bracketing-number constructors", "prove one-point non-vacuity before theorem promotion"]}, {"current_lean_handoffs": ["StatInference.FiniteL1BracketingFamily", "StatInference.L1BracketingSequenceRoute", "StatInference.L1BracketingSequenceRoute.toGlivenkoCantelliClass"], "existing_benchmark_task_ids": ["l1_bracketing_sequence_gc_seed", "finite_endpoint_strong_law_eventual_bound_seed"], "human_review_required": true, "layer": "bracketing_number", "missing_existing_benchmark_task_ids": [], "planned_theorem_hole_seed_ids": ["finite_l1_bracketing_number_constructor_seed", "finite_l1_bracketing_every_scale_to_sequence_route_seed"], "primitive_id": "primitive-l1-bracketing-number", "promotion_gate": "Promote after signatures can construct an explicit finite cover object for any positive scale.", "semantic_risks": ["A bare finite cardinality statement can hide the actual covering functions.", "Unsafe choice of covers can accidentally strengthen the textbook assumption."], "source_anchor_ids": ["vdvw-2.1.6-bracketing-number", "vdvw-2.4.1-finite-l1-bracketing-gc"], "status": "blocked_pending_constructor_signature", "target_lean_module": "StatInference.EmpiricalProcess.L1BracketingNumber", "target_lean_signatures": ["structure L1BracketingCover (F : VdVWFunctionClass \u03a9) (epsilon : \u211d) where Bracket : Type*; finite : Fintype Bracket", "def L1BracketingNumberFiniteAt (F : VdVWFunctionClass \u03a9) (epsilon : \u211d) : Prop", "structure FiniteL1BracketingNumberAtEveryScale (F : VdVWFunctionClass \u03a9) where finite_at : \u2200 epsilon > 0, L1BracketingNumberFiniteAt F epsilon"], "theorem_card_gaps": ["constructor from finite bracketing number at every epsilon to shrinking finite bracket sequence", "finite bracket index type selected at a requested positive radius", "scale sequence epsilon_m descending to zero"], "validation_hooks": ["do not introduce a Nat-valued bracketing number without cover data", "theorem-hole seeds may allow sorry only until the constructor is proved", "run benchmark determinism after adding seeds"]}